{
  "age": 32,
  "job": "technician",
  "marital": "married",
  "education": "professional.course",
  "default": "no",
  "housing": "yes",
  "loan": "no",
  "contact": "cellular",
  "month": "may",
  "day_of_week": "mon",
  "duration": 250,
  "campaign": 1,
  "pdays": 999,
  "previous": 0,
  "poutcome": "nonexistent",
  "emp.var.rate": 1.1,
  "cons.price.idx": 93.994,
  "cons.conf.idx": -36.4,
  "euribor3m": 4.857,
  "nr.employed": 5191.0
}
